<?xml version="1.0" standalone="no"?>
<!DOCTYPE sink SYSTEM "../dtd/sink.dtd">
    <sink>

        <sample>
            <path>
                <dir>file_exists</dir>
            </path>
            <flaw_type>ERR01-J</flaw_type>
            <comment>sink: check if a file exists</comment>
            <imports>
                <import>os</import>
            </imports>
            <code>
	{{flaw}}
        os.path.exists({{in_var_name}})</code>
            <safety safe="0" unsafe="0"/>
            <input_type>string</input_type>
            <exec_type>none</exec_type>
        </sample>

    </sink>
