<?xml version="1.0" standalone="no"?>
<!DOCTYPE sink SYSTEM "../dtd/sink.dtd">
    <sink>

        <sample>
            <path>
                <dir>file_exists</dir>
            </path>
            <flaw_type flaw_group="OWASP_a4">CWE_22</flaw_type>
            <comment>sink: check if a file exists</comment>
            <imports>
                <import>os</import>
            </imports>
            <code>
	'''
	    no curly-curly-flaw-curly-curly line
	'''
        os.path.exists({{in_var_name}})</code>
            <safety safe="0" unsafe="0"/>
            <input_type>string</input_type>
            <exec_type>none</exec_type>
        </sample>

        <sample>
            <path>
                <dir>file_exists</dir>
            </path>
	    <!-- Use SEI CERT flaw name -->
            <flaw_type flaw_group="OWASP_a4">IDS00-PL</flaw_type>
            <comment>sink: check if a file exists</comment>
            <imports>
                <import>os</import>
            </imports>
            <code>
	{{flaw}}
        os.path.exists({{in_var_name}})</code>
            <safety safe="0" unsafe="0"/>
            <input_type>string</input_type>
            <exec_type>none</exec_type>
        </sample>

        <sample>
            <path>
                <dir>ls</dir>
            </path>
	    <!-- different group, same flaw type as above -->
            <flaw_type flaw_group="Zarahemla">CWE_22</flaw_type>
            <comment>sink: run ls in a dir</comment>
            <imports>
                <import>os</import>
            </imports>
            <code>
        {{flaw}}
        os.system('ls ' + {{in_var_name}});
            </code>
            <safety safe="0" unsafe="0"/>
            <input_type>string</input_type>
            <exec_type>none</exec_type>
        </sample>

    </sink>
