<?xml version="1.0" standalone="no"?>
<!DOCTYPE sink SYSTEM "../dtd/sink.dtd">
    <sink>
        <sample>
            <path>
                <dir>file_exists</dir>
            </path>
            <flaw_type flaw_group="OWASP_a4">CWE_22</flaw_type>
            <comment>sink: check if a file exists</comment>
            <imports>
                <import>os</import>
            </imports>
            <code>
                <!--{% filter indent(8) %}
                {{flaw}}-->
        print(os.path.exists({{in_var_name}}))
                <!--{% endfilter %}-->
            </code>
            <safety safe="0" unsafe="0"/>
            <input_type>string</input_type>
            <exec_type>none</exec_type>
        </sample>
    </sink>
