<?xml version="1.0" standalone="no"?>
<!DOCTYPE sink SYSTEM "../dtd/sink.dtd">
    <sink>

        <sample>
            <path>
                <dir>file_exists</dir>
            </path>
            <flaw_type flaw_group="OWASP_a4">IDS00-PL</flaw_type>
            <comment>sink: check if a file exists</comment>
            <imports>
                <import>os</import>
            </imports>
            <code>
	{{flaw}}
        os.path.exists({{in_var_name}})</code>
            <safety safe="0" unsafe="0"/>
            <input_type>string</input_type>
            <exec_type>none</exec_type>
        </sample>

        <sample>
            <path>
	        <!-- repeated <dir> yields the same file name, overwriting previous cases -->
                <dir>file_exists</dir>
            </path>
            <flaw_type flaw_group="OWASP_a4">IDS00-PL</flaw_type>
            <comment>second sink: check if a file exists</comment>
            <imports>
                <import>os</import>
            </imports>
            <code>
        print(f'file "{ {{in_var_name}} }" ', end='')
        {{flaw}}
        if os.path.exists({{in_var_name}}):
	INDENT
            print('exists')
	DEDENT
	else:
	INDENT
            print('does not exist')
	DEDENT
	    </code>
            <safety safe="0" unsafe="0"/>
            <input_type>string</input_type>
            <exec_type>none</exec_type>
        </sample>

    </sink>
